{
  "$schema": "./release-manifest.schema.json",
  "schemaVersion": "context-action-v1-release-manifest.v3",
  "status": "published-pending-provenance",
  "release": "context-action-v1.0.0",
  "commit": "63f790a521e3428a7a2825677747338f8f05ccf3",
  "prePublicationAudit": null,
  "distTag": "next",
  "registryEvidence": {
    "@context-action/core": {
      "version": "1.0.0",
      "integrity": "sha512-WVMCxAwZkoMTQZYgL9Ha7OqKWEQxu7Z9R6DnxcdLcFQXWEEDIVyzL4hKojTmMRwh1BFup7zirbfITSkX5vIEXQ==",
      "sha256": "d83869e72cfbb46da0a581bf23bb77195f8fb0254dbe64ff6da98625b5837c08",
      "tarball": "https://registry.npmjs.org/@context-action/core/-/core-1.0.0.tgz",
      "publishedAt": "2026-08-09T10:13:18.315Z",
      "distTags": { "latest": "0.9.2", "rc": "1.0.0-rc.0", "next": "1.0.0" },
      "provenance": { "status": "pending-verification", "sourceCommit": "63f790a521e3428a7a2825677747338f8f05ccf3" },
      "externalConsumer": { "status": "passed" }
    },
    "@context-action/react": {
      "version": "1.0.0",
      "integrity": "sha512-35KHuhJ1liCkPUF7h2s9Nef/rtWkfYK1L3f30fioniK7aUFsBK4YoW+Yk73NKBqVpIW3XlWkeVJMoQPeuYozmQ==",
      "sha256": "f5dae62522137ee912afff9e589e6381110a1ba807b0cd07853f5cab5d4306c3",
      "tarball": "https://registry.npmjs.org/@context-action/react/-/react-1.0.0.tgz",
      "publishedAt": "2026-08-09T10:13:35.051Z",
      "distTags": { "latest": "0.9.2", "rc": "1.0.0-rc.0", "next": "1.0.0" },
      "provenance": { "status": "pending-verification", "sourceCommit": "63f790a521e3428a7a2825677747338f8f05ccf3" },
      "externalConsumer": { "status": "passed" }
    },
    "@context-action/tool-protocol": {
      "version": "1.0.0",
      "integrity": "sha512-sOW7dwTajB+j0N0prU7T3fmnJaDkLzZNegRHr2y9pBoZuEeEaOv+olOBN7zRSzPYLBDCD8DyT/eN/SVq8F8Alg==",
      "sha256": "8e8b1e67ca3854351f3f0a2bba16fa71f08d15530db971c22cdb3321193d06bf",
      "tarball": "https://registry.npmjs.org/@context-action/tool-protocol/-/tool-protocol-1.0.0.tgz",
      "publishedAt": "2026-08-09T10:13:10.741Z",
      "distTags": { "latest": "0.8.8", "next": "1.0.0", "rc": "1.0.0-rc.0" },
      "provenance": { "status": "pending-verification", "sourceCommit": "63f790a521e3428a7a2825677747338f8f05ccf3" },
      "externalConsumer": { "status": "passed" }
    },
    "@context-action/webmcp": {
      "version": "0.1.0",
      "integrity": "sha512-WNWV6etlsXhomBvj/3Vgay79M7aBZBYxyUvec7sWEFef4GxEY57GDKgpYDHCXUv6fF4L52iJWhZpPQBs2YZ+mw==",
      "sha256": "2276b9fbc458ab27462c7799490f3e39e6e8a0faaa80e19a1444dbccc2035301",
      "tarball": "https://registry.npmjs.org/@context-action/webmcp/-/webmcp-0.1.0.tgz",
      "publishedAt": "2026-08-09T10:13:25.316Z",
      "distTags": { "rc": "0.1.0-rc.0", "latest": "0.1.0-rc.0", "next": "0.1.0" },
      "provenance": { "status": "pending-verification", "sourceCommit": "63f790a521e3428a7a2825677747338f8f05ccf3" },
      "externalConsumer": { "status": "passed" }
    }
  },
  "audit": null,
  "packages": {
    "@context-action/core": "1.0.0",
    "@context-action/react": "1.0.0",
    "@context-action/tool-protocol": "1.0.0",
    "@context-action/webmcp": "0.1.0"
  },
  "stableSurfaces": [
    "@context-action/core",
    "@context-action/react",
    "@context-action/tool-protocol"
  ],
  "experimentalSurfaces": [
    "@context-action/webmcp",
    "@context-action/react/webmcp"
  ],
  "testedExternalDependencies": {
    "@context-action/mutative": {
      "classification": "tested-external-dependency",
      "supportedRange": "^0.8.8",
      "testedVersion": "0.8.8"
    },
    "@context-action/tool-durable-operations": {
      "classification": "tested-external-dependency",
      "supportedRange": "^0.1.1",
      "testedVersion": "0.1.1"
    }
  },
  "promotionTargets": {
    "@context-action/core": "latest",
    "@context-action/react": "latest",
    "@context-action/tool-protocol": "latest",
    "@context-action/webmcp": "latest"
  },
  "requiredBeforeCertification": [
    "Independently verify the recorded npm provenance source commit for every published package.",
    "Obtain the independent adversarial audit required for RC certification."
  ]
}
